trial_id,nct_id,brief_title,overall_status,conditions,study_type,url,notes
NCT06077630,NCT06077630,Non-attendance Prediction Models to Pediatric Outpatient Appointments,COMPLETED,"Non-Attendance, Patient;No-Show Patients",OBSERVATIONAL,https://clinicaltrials.gov/study/NCT06077630,T043 harvest tag=T043_ml query=machine learning
NCT07030998,NCT07030998,Wearable Technology and Machine Learning for Early Detection and Risk Assessment of Unacceptable Toxicities in a Paediatric Oncology Cohort,RECRUITING,Cancer;Infection;Digital Health;Wearable Devices,OBSERVATIONAL,https://clinicaltrials.gov/study/NCT07030998,T043 harvest tag=T043_ml query=machine learning
NCT06939387,NCT06939387,Drug-induced Kidney Injury Model,RECRUITING,Acute Kidney Injury,OBSERVATIONAL,https://clinicaltrials.gov/study/NCT06939387,T043 harvest tag=T043_ml query=machine learning
NCT05375955,NCT05375955,A Study to Learn About The Study Medicine (PF-07038124) In Patients With Mild To Moderate Atopic Dermatitis Or Mild To Severe Plaque Psoriasis.,COMPLETED,Atopic Dermatitis;Plaque Psoriasis,INTERVENTIONAL,https://clinicaltrials.gov/study/NCT05375955,T043 harvest tag=T043_ml query=machine learning
NCT05685355,NCT05685355,AI Gum Health Evaluation with Smartphone,RECRUITING,Gingivitis,OBSERVATIONAL,https://clinicaltrials.gov/study/NCT05685355,T043 harvest tag=T043_ml query=machine learning
NCT02580435,NCT02580435,Deciphering the Role of the Gut Microbiota in Multiple Sclerosis,UNKNOWN,Multiple Sclerosis,OBSERVATIONAL,https://clinicaltrials.gov/study/NCT02580435,T043 harvest tag=T043_ml query=machine learning
NCT03592368,NCT03592368,Hostile Interpretation Bias Training to Treat Irritability,COMPLETED,Irritable Mood;Mood Disorders,INTERVENTIONAL,https://clinicaltrials.gov/study/NCT03592368,T043 harvest tag=T043_ml query=machine learning
NCT05392413,NCT05392413,Immune Indicator Model for Predicting Efficacy of PD-1 Monoclonal Antibody,RECRUITING,Esophageal Squamous Cell Carcinoma;PD-1 Inhibitor,OBSERVATIONAL,https://clinicaltrials.gov/study/NCT05392413,T043 harvest tag=T043_ml query=machine learning
NCT06498050,NCT06498050,Brolucizumab Efficacy and Safety Single-Arm Descriptive Trial in Patients With Persistent Diabetic Macular Edema,ACTIVE_NOT_RECRUITING,Diabetic Macular Edema,INTERVENTIONAL,https://clinicaltrials.gov/study/NCT06498050,T043 harvest tag=T043_ml query=machine learning
NCT04890847,NCT04890847,A Platform for Multidisciplinary Medical Artificial Intelligence Development,UNKNOWN,Medical Artificial Intelligence;Medical Imaging,OBSERVATIONAL,https://clinicaltrials.gov/study/NCT04890847,T043 harvest tag=T043_ml query=machine learning
NCT06306248,NCT06306248,"Immune Activation, Neural Plasticity and Depression",UNKNOWN,Mood Disorders;Major Depressive Disorder;Sleep Deprivation,OBSERVATIONAL,https://clinicaltrials.gov/study/NCT06306248,T043 harvest tag=T043_ml query=machine learning
NCT03905226,NCT03905226,Development of a Predictive Algorithm for the Risk of Rehospitalization of Patients With Heart Failure,COMPLETED,Heart Failure,OBSERVATIONAL,https://clinicaltrials.gov/study/NCT03905226,T043 harvest tag=T043_ml query=machine learning
NCT05381376,NCT05381376,Multicentre Prospective Clinical Database for the Construction of Predictive Models on Risk of Intrauterine Adhesion,UNKNOWN,Database for Intrauterine Adhesion;Risk Factors for Intrauterine Adhesion;Risk Stratification and Prognostic Assessment;Intrauterine Adhesion,OBSERVATIONAL,https://clinicaltrials.gov/study/NCT05381376,T043 harvest tag=T043_ml query=machine learning
NCT04430491,NCT04430491,To Evaluate the Use of Radiomics to Classify Between Idiopathic Pulmonary Fibrosis and Interstitial Lung Disease,COMPLETED,Interstitial Lung Disease;Idiopathic Pulmonary Fibrosis;Usual Interstitial Pneumonia,OBSERVATIONAL,https://clinicaltrials.gov/study/NCT04430491,T043 harvest tag=T043_ml query=machine learning
NCT02471313,NCT02471313,Integrated Imaging Strategy to Phenotype Progression of Liver Tumors During and After Chemoembolization,COMPLETED,Liver Cancer;Liver Neoplasm;Hepatocellular Carcinoma;HCC,INTERVENTIONAL,https://clinicaltrials.gov/study/NCT02471313,T043 harvest tag=T043_ml query=machine learning
NCT05220306,NCT05220306,AIDI - Research & Development of a Multisensor-Based Machine Learning Technology for Real-Time Automated Detection of COVID-19 Decompensation,WITHDRAWN,Sars-CoV-2 Infection,INTERVENTIONAL,https://clinicaltrials.gov/study/NCT05220306,T043 harvest tag=T043_ml query=machine learning
NCT03065335,NCT03065335,Neuropharmacologic Imaging and Biomarker Assessments of Response to Acute and Repeated-Dosed Ketamine Infusions in Major Depressive Disorder,RECRUITING,Healthy Volunteer;Major Depressive Disorder;Depression,INTERVENTIONAL,https://clinicaltrials.gov/study/NCT03065335,T043 harvest tag=T043_ml query=machine learning
NCT07051408,NCT07051408,Predictors Of Cognitive Decline Using Digital Devices,ACTIVE_NOT_RECRUITING,Dementia;Mild Cognitive Impairment (MCI);Subjective Cognitive Decline (SCD);Rapid Eye Movement Sleep Behavior Disorder;Healthy Control Patients of the Same Age,OBSERVATIONAL,https://clinicaltrials.gov/study/NCT07051408,T043 harvest tag=T043_ml query=machine learning
NCT06124391,NCT06124391,Novel Subtypes of Polycystic Ovary Syndrome,UNKNOWN,Polycystic Ovary Syndrome,OBSERVATIONAL,https://clinicaltrials.gov/study/NCT06124391,T043 harvest tag=T043_ml query=machine learning
NCT04786431,NCT04786431,Shotgun Mass Spectrometry-based Lipid Profiling in Chronic Inflammatory Diseases,COMPLETED,Biomarker;Lipid;Inflammation;Cardiovascular Diseases;Ischemic Stroke;Systemic Lupus Erythematosus;Healthy,OBSERVATIONAL,https://clinicaltrials.gov/study/NCT04786431,T043 harvest tag=T043_ml query=machine learning
NCT06163781,NCT06163781,Appropriate Use of Blood Cultures in the Emergency Department Through Machine Learning,RECRUITING,"Artificial Intelligence;Machine Learning;Microbiology;Emergency Service, Hospital;Randomized Controlled Trial",INTERVENTIONAL,https://clinicaltrials.gov/study/NCT06163781,T043 harvest tag=T043_ml query=machine learning
NCT04884412,NCT04884412,Deep Brain Stimulation for Parkinson's Disease: Probabilistic STN Targeting Under General Anaesthesia Without Micro-electrode Recordings vs Current Targeting Procedure,COMPLETED,Parkinson Disease,INTERVENTIONAL,https://clinicaltrials.gov/study/NCT04884412,T043 harvest tag=T043_ml query=machine learning
NCT04584281,NCT04584281,Artificial Intelligence (AI) in Cardiotocography (CTG) Interpretation,UNKNOWN,To Introduce Artificial Intelligence (AI) and Machine Learning in Cardiotocography (CTG) Interpretation to Improve Clinical Use,OBSERVATIONAL,https://clinicaltrials.gov/study/NCT04584281,T043 harvest tag=T043_ml query=machine learning
NCT06226428,NCT06226428,Cyclo-Ergometry in the Patient With Acute Respiratory Distress Syndrome,COMPLETED,Coronavirus,INTERVENTIONAL,https://clinicaltrials.gov/study/NCT06226428,T043 harvest tag=T043_ml query=machine learning
NCT06337357,NCT06337357,Results of Progressive Resistance Training in Older Type 2 Diabetic Patients With Sarcopenia,RECRUITING,Sarcopenia;Diabetes,INTERVENTIONAL,https://clinicaltrials.gov/study/NCT06337357,T043 harvest tag=T043_ml query=machine learning
NCT04584801,NCT04584801,SLP Model Development in the Diagnosis of COPD Patients,COMPLETED,COPD;Healthy Smoker,OBSERVATIONAL,https://clinicaltrials.gov/study/NCT04584801,T043 harvest tag=T043_ml query=machine learning
NCT05930444,NCT05930444,Multimodal Machine Learning for Auxiliary Diagnosis of Eye Diseases,COMPLETED,Eye Diseases,OBSERVATIONAL,https://clinicaltrials.gov/study/NCT05930444,T043 harvest tag=T043_ml query=machine learning
NCT06498102,NCT06498102,Time-restricted Feeding Improves Basal Fat Oxidation and Body Composition But Not Fat Oxidation During Exercise,COMPLETED,Dietary Exposure,INTERVENTIONAL,https://clinicaltrials.gov/study/NCT06498102,T043 harvest tag=T043_ml query=machine learning
NCT03882034,NCT03882034,Safety and Efficacy of Pegvisomant in Children With Growth Hormone Excess,COMPLETED,Pituitary Disease,INTERVENTIONAL,https://clinicaltrials.gov/study/NCT03882034,T043 harvest tag=T043_ml query=machine learning
NCT06013709,NCT06013709,A Machine Learning Algorithm to Predict Health Clinical Situations in Primary Healthcare for Frail Older Adults.,COMPLETED,Frail Elderly Syndrome,OBSERVATIONAL,https://clinicaltrials.gov/study/NCT06013709,T043 harvest tag=T043_ml query=machine learning
